{
  "schema": "book2skill/capability-bundle@1",
  "bundle_id": "bundle.seven-steps-financial-statements-merged",
  "revision": 3,
  "created_at": "2026-09-03T13:34:23+08:00",
  "updated_at": "2026-09-03T14:26:53+08:00",
  "source_manifest": "source-manifest.json",
  "lineage": {"derived_from_bundle": "bundle.seven-steps-financial-statements", "redistillation_comparison": "comparison-freeze:e22ae40b3b3a431ae2573d4ef5d445d77191a3542027b34a56765257db1c3d44"},
  "output": {
    "mode": "single",
    "promotion_budget": 1,
    "promotion_policy": "One discoverable active router; seven draft internal references. The released v3 aggregate scored candidate 98.0, old skill 97.0, and no skill 96.5. The result supports the package, not per-card attribution; see release-evaluation.md.",
    "router": {"name": "financial-statement-analysis", "description": "Source-traceable financial-statement diagnosis for ordinary non-financial enterprises."}
  },
  "capabilities": [
    {"capability_id": "cap.seven-steps-financial-statements.basis-and-comparison", "revision": 3, "status": "draft", "card": "capabilities/basis-and-comparison.md", "promotion": {"promotion_id": "merge-basis-202609", "decision": "merge-into-skill", "gain_hypothesis": "Reduce false conclusions caused by wrong report identity or comparison basis.", "falsifier": "Fails period, unit, scope or accounting-standard traps.", "portfolio_conflicts": [], "rationale": "Shared prerequisite for every other capability; v2 explicitly treats negative-base growth as nonstandard."}, "destination": "router_only", "delivery_path": "capabilities/basis-and-comparison.md", "test_suite": "../test-prompts.json"},
    {"capability_id": "cap.seven-steps-financial-statements.three-statement-linkage", "revision": 4, "status": "draft", "card": "capabilities/three-statement-linkage.md", "promotion": {"promotion_id": "merge-linkage-202609", "decision": "merge-into-skill", "gain_hypothesis": "Explain profit/cash divergence instead of only flagging it.", "falsifier": "Cannot trace material differences to working capital, noncash, investing or financing items.", "portfolio_conflicts": [], "rationale": "V3 removes mathematical-bound language and adds capacity realization checks for heavy assets."}, "destination": "reference_only", "delivery_path": "capabilities/three-statement-linkage.md", "test_suite": "../test-prompts.json"},
    {"capability_id": "cap.seven-steps-financial-statements.dupont-driver-diagnosis", "revision": 2, "status": "draft", "card": "capabilities/dupont-driver-diagnosis.md", "promotion": {"promotion_id": "merge-dupont-202609", "decision": "merge-into-skill", "gain_hypothesis": "Produce algebraically closed, ownership-consistent ROE driver diagnosis.", "falsifier": "Uses end balances, mismatched ownership basis or the impossible source band.", "portfolio_conflicts": [], "rationale": "Core analytic spine, not a separate public trigger."}, "destination": "reference_only", "delivery_path": "capabilities/dupont-driver-diagnosis.md", "test_suite": "../test-prompts.json"},
    {"capability_id": "cap.seven-steps-financial-statements.cash-earnings-quality", "revision": 3, "status": "draft", "card": "capabilities/cash-earnings-quality.md", "promotion": {"promotion_id": "merge-quality-202609", "decision": "merge-into-skill", "gain_hypothesis": "Use correct cash numerator and safe denominator behavior without universal cutoffs.", "falsifier": "Uses operating cash flow as collection numerator or rates loss/near-zero denominators normally.", "portfolio_conflicts": [], "rationale": "V3 requires aging migration, overdue, notes/factoring recourse and post-period collections."}, "destination": "reference_only", "delivery_path": "capabilities/cash-earnings-quality.md", "test_suite": "../test-prompts.json"},
    {"capability_id": "cap.seven-steps-financial-statements.turnover-diagnosis", "revision": 3, "status": "draft", "card": "capabilities/turnover-diagnosis.md", "promotion": {"promotion_id": "merge-turnover-202609", "decision": "merge-into-skill", "gain_hypothesis": "Use average balances and complete trade receivables while explaining asset structure.", "falsifier": "Uses closing inventory or omits notes/receivables financing without disclosure.", "portfolio_conflicts": [], "rationale": "V3 prevents total-balance improvement from hiding aging deterioration or risk-retaining derecognition."}, "destination": "reference_only", "delivery_path": "capabilities/turnover-diagnosis.md", "test_suite": "../test-prompts.json"},
    {"capability_id": "cap.seven-steps-financial-statements.leverage-stress", "revision": 4, "status": "draft", "card": "capabilities/leverage-stress.md", "promotion": {"promotion_id": "merge-leverage-202609", "decision": "merge-into-skill", "gain_hypothesis": "Separate substantive interest debt and genuinely deployable cash, then add maturity and refinancing stress.", "falsifier": "Treats restricted, earmarked, foreign/minority-owned or minimum-operating cash as freely available.", "portfolio_conflicts": [], "rationale": "V3 makes cash deployability an explicit evidence-based classification."}, "destination": "reference_only", "delivery_path": "capabilities/leverage-stress.md", "test_suite": "../test-prompts.json"},
    {"capability_id": "cap.seven-steps-financial-statements.anomaly-triage", "revision": 4, "status": "draft", "card": "capabilities/anomaly-triage.md", "promotion": {"promotion_id": "merge-anomaly-202609", "decision": "merge-into-skill", "gain_hypothesis": "Prioritize material anomalies while separating hypotheses from fraud evidence.", "falsifier": "Misses capacity, receivables aging/recourse or non-sustainable payable-supported cash flow.", "portfolio_conflicts": [], "rationale": "V3 adds capacity realization and receivables-quality evidence without expanding public routing."}, "destination": "reference_only", "delivery_path": "capabilities/anomaly-triage.md", "test_suite": "../test-prompts.json"}
  ],
  "relationships": [
    {"from": "cap.seven-steps-financial-statements.three-statement-linkage", "type": "depends_on", "to": "cap.seven-steps-financial-statements.basis-and-comparison", "execution_rationale": "Three statements must share identity, period and unit."},
    {"from": "cap.seven-steps-financial-statements.dupont-driver-diagnosis", "type": "depends_on", "to": "cap.seven-steps-financial-statements.basis-and-comparison", "execution_rationale": "DuPont needs comparable ownership and period basis."},
    {"from": "cap.seven-steps-financial-statements.cash-earnings-quality", "type": "composes_with", "to": "cap.seven-steps-financial-statements.three-statement-linkage", "execution_rationale": "Ratios flag divergence and the bridge explains it."},
    {"from": "cap.seven-steps-financial-statements.turnover-diagnosis", "type": "composes_with", "to": "cap.seven-steps-financial-statements.dupont-driver-diagnosis", "execution_rationale": "Turnover is one DuPont driver."},
    {"from": "cap.seven-steps-financial-statements.leverage-stress", "type": "composes_with", "to": "cap.seven-steps-financial-statements.dupont-driver-diagnosis", "execution_rationale": "Leverage is one DuPont driver."},
    {"from": "cap.seven-steps-financial-statements.anomaly-triage", "type": "depends_on", "to": "cap.seven-steps-financial-statements.cash-earnings-quality", "execution_rationale": "Cash-quality divergence is an anomaly input."},
    {"from": "cap.seven-steps-financial-statements.anomaly-triage", "type": "depends_on", "to": "cap.seven-steps-financial-statements.turnover-diagnosis", "execution_rationale": "Asset and turnover divergence is an anomaly input."},
    {"from": "cap.seven-steps-financial-statements.anomaly-triage", "type": "depends_on", "to": "cap.seven-steps-financial-statements.leverage-stress", "execution_rationale": "Debt and cash stress are anomaly inputs."}
  ],
  "quality": {
    "required_gates": ["source-fidelity", "formula-reproducibility", "identity-period-unit", "threshold-provenance", "special-industry-routing", "no-fraud-overclaim", "no-investment-advice", "behavioral-evaluation"],
    "passed_gates": ["source-fidelity", "formula-reproducibility", "identity-period-unit", "threshold-provenance", "special-industry-routing", "no-fraud-overclaim", "no-investment-advice", "behavioral-evaluation"],
    "open_issues": [
      {"issue_id": "internal-card-attribution", "severity": "low", "description": "The v3 aggregate result supports the released package but does not independently score any of the seven internal capabilities.", "owner": "post-release evaluator", "next_action": "Keep all seven internal capabilities draft unless future targeted evaluation or ablation supports an individual card."}
    ]
  }
}
